{
  "$schema": "./tags.schema.json",
  "methodology": "BRIDGE",
  "schemaVersion": "1.0.0",
  "description": "Canonical registry of BRIDGE layer-name tags and the boundary with structured Figma metadata and namespaced bridge contracts.",
  "statusLevels": [
    "stable",
    "experimental",
    "deprecated"
  ],
  "scopeLevels": [
    "page-root",
    "variant-root",
    "layer",
    "control",
    "field",
    "target",
    "collection",
    "item"
  ],
  "sourceOfTruthLevels": [
    "bridge-tag",
    "figma-metadata"
  ],
  "structuredMetadata": {
    "namespace": "bridge",
    "schema": "./bridge.schema.json",
    "rule": "Use layer tags only for compact transfer intent and identity anchors. Put data, responsive transformations, interaction graphs, motion, accessibility, and delivery lifecycle in the namespaced structured contract."
  },
  "tags": [
    {
      "key": "page",
      "title": {
        "en": "Page identity",
        "ru": "Идентификатор страницы"
      },
      "status": "stable",
      "authoredInLayerName": true,
      "sourceOfTruth": "bridge-tag",
      "scope": [
        "page-root"
      ],
      "form": "property",
      "value": {
        "kind": "kebab-case",
        "pattern": "^[a-z0-9]+(?:-[a-z0-9]+)*$"
      },
      "identityBearing": true,
      "companions": {
        "requires": [
          "bp",
          "view"
        ]
      },
      "notes": {
        "en": "A BRIDGE page root always uses native Auto Layout and must never carry [asset].",
        "ru": "Корень страницы BRIDGE всегда использует нативный Auto Layout и никогда не содержит [asset]."
      }
    },
    {
      "key": "route",
      "title": {
        "en": "Production route",
        "ru": "Рабочий маршрут"
      },
      "status": "stable",
      "authoredInLayerName": true,
      "sourceOfTruth": "bridge-tag",
      "scope": [
        "page-root"
      ],
      "form": "property",
      "value": {
        "kind": "route",
        "pattern": "^/(?:[^\\s?#]+/?)*(?:#[a-z0-9]+(?:-[a-z0-9]+)*)?$"
      },
      "identityBearing": false,
      "companions": {
        "requires": [
          "page"
        ],
        "conflicts": [
          "route-pattern"
        ]
      }
    },
    {
      "key": "route-pattern",
      "title": {
        "en": "Dynamic route pattern",
        "ru": "Шаблон динамического маршрута"
      },
      "status": "experimental",
      "authoredInLayerName": true,
      "sourceOfTruth": "bridge-tag",
      "scope": [
        "page-root"
      ],
      "form": "property",
      "value": {
        "kind": "route-pattern",
        "pattern": "^/(?:[^\\s?#]+/?)*:[a-z][a-z0-9-]*(?:/(?:[^\\s?#]+|:[a-z][a-z0-9-]*))*$"
      },
      "identityBearing": false,
      "companions": {
        "requires": [
          "page"
        ],
        "conflicts": [
          "route"
        ]
      }
    },
    {
      "key": "bp",
      "title": {
        "en": "Control width",
        "ru": "Контрольная ширина"
      },
      "status": "stable",
      "authoredInLayerName": true,
      "sourceOfTruth": "bridge-tag",
      "scope": [
        "page-root"
      ],
      "form": "property",
      "value": {
        "kind": "positive-integer",
        "pattern": "^[1-9][0-9]*$"
      },
      "identityBearing": false,
      "companions": {
        "requires": [
          "page"
        ]
      }
    },
    {
      "key": "view",
      "title": {
        "en": "Page view",
        "ru": "Вид страницы"
      },
      "status": "stable",
      "authoredInLayerName": true,
      "sourceOfTruth": "bridge-tag",
      "scope": [
        "page-root"
      ],
      "form": "property",
      "value": {
        "kind": "kebab-case",
        "pattern": "^[a-z0-9]+(?:-[a-z0-9]+)*$"
      },
      "identityBearing": false,
      "companions": {
        "requires": [
          "page"
        ]
      }
    },
    {
      "key": "anchor",
      "title": {
        "en": "Anchor target",
        "ru": "Цель якоря"
      },
      "status": "stable",
      "authoredInLayerName": true,
      "sourceOfTruth": "bridge-tag",
      "scope": [
        "layer"
      ],
      "form": "property",
      "value": {
        "kind": "kebab-case",
        "pattern": "^[a-z0-9]+(?:-[a-z0-9]+)*$"
      },
      "identityBearing": true,
      "companions": {}
    },
    {
      "key": "section",
      "title": {
        "en": "Page section identity",
        "ru": "Идентификатор секции"
      },
      "status": "stable",
      "authoredInLayerName": true,
      "sourceOfTruth": "bridge-tag",
      "scope": [
        "layer"
      ],
      "form": "property",
      "value": {
        "kind": "kebab-case",
        "pattern": "^[a-z0-9]+(?:-[a-z0-9]+)*$"
      },
      "identityBearing": true,
      "companions": {
        "conflicts": [
          "modal",
          "state",
          "field",
          "collection",
          "item",
          "form"
        ]
      },
      "notes": {
        "en": "A frame-built section or editable Page Sections source root uses native Auto Layout unless the exact section is a genuine opaque whole-visual asset. Page Check treats a placed INSTANCE as atomic; audit its source separately.",
        "ru": "Секция-фрейм или редактируемый исходный корень Page Sections использует нативный Auto Layout, кроме точной секции, которая является настоящим непрозрачным цельным визуальным ресурсом. Page Check считает размещённый INSTANCE атомарным; его источник проверяется отдельно."
      }
    },
    {
      "key": "href",
      "title": {
        "en": "Navigation destination",
        "ru": "Адрес перехода"
      },
      "status": "stable",
      "authoredInLayerName": true,
      "sourceOfTruth": "bridge-tag",
      "scope": [
        "layer",
        "control"
      ],
      "form": "property",
      "value": {
        "kind": "href",
        "pattern": "^(?:/(?!/)[^\\s]*|#[a-z0-9]+(?:-[a-z0-9]+)*|https?://[^\\s]+|mailto:[^\\s@]+@[^\\s@]+|tel:\\+?[0-9() .-]+)$"
      },
      "identityBearing": false,
      "companions": {
        "conflicts": [
          "action"
        ]
      }
    },
    {
      "key": "link",
      "title": {
        "en": "Draft link or advanced link identity",
        "ru": "Черновая ссылка или расширенный идентификатор ссылки"
      },
      "status": "stable",
      "authoredInLayerName": true,
      "sourceOfTruth": "bridge-tag",
      "scope": [
        "layer",
        "control"
      ],
      "form": "boolean-or-property",
      "value": {
        "kind": "kebab-case",
        "pattern": "^[a-z0-9]+(?:-[a-z0-9]+)*$"
      },
      "identityBearing": true,
      "companions": {
        "conflicts": [
          "action",
          "control"
        ]
      },
      "notes": {
        "en": "Prefer [href=...] when the destination is known; the value form is an advanced override.",
        "ru": "Когда адрес известен, используйте [href=...]; форма со значением предназначена только для расширенного переопределения."
      }
    },
    {
      "key": "open",
      "title": {
        "en": "Link opening behavior",
        "ru": "Способ открытия ссылки"
      },
      "status": "stable",
      "authoredInLayerName": true,
      "sourceOfTruth": "bridge-tag",
      "scope": [
        "control"
      ],
      "form": "property",
      "value": {
        "kind": "enum",
        "enum": [
          "new-tab"
        ]
      },
      "identityBearing": false,
      "companions": {
        "requiresAny": [
          "href",
          "link"
        ]
      }
    },
    {
      "key": "a11y-label",
      "title": {
        "en": "Accessible control label",
        "ru": "Доступное название элемента управления"
      },
      "status": "stable",
      "authoredInLayerName": true,
      "sourceOfTruth": "bridge-tag",
      "scope": [
        "control"
      ],
      "form": "property",
      "value": {
        "kind": "human-text",
        "minLength": 1
      },
      "identityBearing": false,
      "companions": {
        "requiresAny": [
          "href",
          "link",
          "action",
          "control"
        ]
      }
    },
    {
      "key": "action",
      "title": {
        "en": "Non-navigation action",
        "ru": "Ненавигационное действие"
      },
      "status": "stable",
      "authoredInLayerName": true,
      "sourceOfTruth": "bridge-tag",
      "scope": [
        "control"
      ],
      "form": "property",
      "value": {
        "kind": "action",
        "pattern": "^(?:modal|state|submit|reset):[a-z0-9]+(?:-[a-z0-9]+)*$|^none$"
      },
      "identityBearing": false,
      "companions": {
        "conflicts": [
          "href",
          "link"
        ]
      }
    },
    {
      "key": "control",
      "title": {
        "en": "Draft control or advanced control identity",
        "ru": "Черновой элемент управления или его расширенный идентификатор"
      },
      "status": "stable",
      "authoredInLayerName": true,
      "sourceOfTruth": "bridge-tag",
      "scope": [
        "control"
      ],
      "form": "boolean-or-property",
      "value": {
        "kind": "kebab-case",
        "pattern": "^[a-z0-9]+(?:-[a-z0-9]+)*$"
      },
      "identityBearing": true,
      "companions": {
        "conflicts": [
          "href",
          "link"
        ]
      },
      "notes": {
        "en": "Prefer [action=...] when behavior is known; the value form is an advanced override.",
        "ru": "Когда действие известно, используйте [action=...]; форма со значением предназначена только для расширенного переопределения."
      }
    },
    {
      "key": "field",
      "title": {
        "en": "Field identity",
        "ru": "Идентификатор поля"
      },
      "status": "stable",
      "authoredInLayerName": true,
      "sourceOfTruth": "bridge-tag",
      "scope": [
        "field"
      ],
      "form": "property",
      "value": {
        "kind": "kebab-case",
        "pattern": "^[a-z0-9]+(?:-[a-z0-9]+)*$"
      },
      "identityBearing": true,
      "companions": {